<?xml version="1.0" encoding="UTF-8"?>
<dataroot xmlns:od="urn:schemas-microsoft-com:officedata" xmlns:xsi="http://www.w3.org/2001/XMLSchema-instance"  xsi:noNamespaceSchemaLocation="Games.xsd" generated="2012-07-27T16:05:18">
<Games>
<ID>190</ID>
<Round>21</Round>
<Team1>Brisbane</Team1>
  <Result1>WIN</Result1>
  <Score1>13.17 (95)</Score1>
<Team2>Adelaide</Team2>
  <Result2>LOSS</Result2>
  <Score2>12.13 (85)</Score2>
<HomeTeam>1</HomeTeam>
</Games>
<Games>
<ID>191</ID>
<Round>21</Round>
<Team1>Collingwood</Team1>
  <Result1>LOSS</Result1>
  <Score1>8.13 (61)</Score1>
<Team2>North Melbourne</Team2>
  <Result2>WIN</Result2>
  <Score2>13.13 (91)</Score2>
<HomeTeam>1</HomeTeam>
</Games>
<Games>
<ID>192</ID>
<Round>21</Round>
<Team1>Essendon</Team1>
  <Result1>LOSS</Result1>
  <Score1>8.12 (60)</Score1>
<Team2>Carlton</Team2>
  <Result2>WIN</Result2>
  <Score2>24.12 (156)</Score2>
<HomeTeam>1</HomeTeam>
</Games>
<Games>
<ID>193</ID>
<Round>21</Round>
<Team1>Fremantle</Team1>
  <Result1>WIN</Result1>
  <Score1>13.16 (94)</Score1>
<Team2>Richmond</Team2>
  <Result2>LOSS</Result2>
  <Score2>11.6 (72)</Score2>
<HomeTeam>1</HomeTeam>
</Games>
<Games>
<ID>194</ID>
<Round>21</Round>
<Team1>Geelong</Team1>
  <Result1>WIN</Result1>
  <Score1>18.15 (123)</Score1>
<Team2>St Kilda</Team2>
  <Result2>LOSS</Result2>
  <Score2>11.15 (81)</Score2>
<HomeTeam>1</HomeTeam>
</Games>
<Games>
<ID>195</ID>
<Round>21</Round>
<Team1>Greater Western Sydney</Team1>
  <Result1>LOSS</Result1>
  <Score1>9.5 (59)</Score1>
<Team2>Melbourne</Team2>
  <Result2>WIN</Result2>
  <Score2>11.18 (84)</Score2>
<HomeTeam>1</HomeTeam>
</Games>
<Games>
<ID>196</ID>
<Round>21</Round>
<Team1>Hawthorn</Team1>
  <Result1>WIN</Result1>
  <Score1>19.15 (129)</Score1>
<Team2>Gold Coast</Team2>
  <Result2>LOSS</Result2>
  <Score2>10.5 (65)</Score2>
<HomeTeam>1</HomeTeam>
</Games>
<Games>
<ID>197</ID>
<Round>21</Round>
<Team1>Port Adelaide</Team1>
  <Result1>LOSS</Result1>
  <Score1>6.14 (50)</Score1>
<Team2>West Coast</Team2>
  <Result2>WIN</Result2>
  <Score2>14.14 (98)</Score2>
<HomeTeam>1</HomeTeam>
</Games>
<Games>
<ID>198</ID>
<Round>21</Round>
<Team1>Western Bulldogs</Team1>
  <Result1>LOSS</Result1>
  <Score1>13.7 (85)</Score1>
<Team2>Sydney</Team2>
  <Result2>WIN</Result2>
  <Score2>26.11 (167)</Score2>
<HomeTeam>1</HomeTeam>
</Games>
</dataroot>
